"Company Name","Job Title","Job URL"
Instacart,"Senior Software Developer in Test, Caper",https://instacart.careers/job/?gh_jid=5661247
Wish,"Senior Software Engineer",https://jobs.smartrecruiters.com/Wish/743999943752824-senior-software-engineer
Wish,"Staff Software Engineer",https://jobs.smartrecruiters.com/Wish/743999943753193-staff-software-engineer
Arcules,"Software Test Engineer",https://recruitingbypaycor.com/career/JobIntroduction.action?clientId=8a7883d0612bf7a001614d5a19117dc9&id=8a7887a88d19fe9a018d7f7bc4720764&source=&lang=en
Arcules,"Principal Software Engineer/Architect",https://recruitingbypaycor.com/career/JobIntroduction.action?clientId=8a7883d0612bf7a001614d5a19117dc9&id=8a7885ac8d19fe92018d3d02cb696ec7&source=&lang=en
Chewy,"Software Engineer III Front End",https://careers.chewy.com/us/en/job/5598430/Software-Engineer-III-Front-End
Chewy,"Senior Software Engineer - Oracle Service Cloud",https://careers.chewy.com/us/en/job/5744136/Senior-Software-Engineer-Oracle-Service-Cloud
Chewy,"Software Engineer III",https://careers.chewy.com/us/en/job/5703896/Software-Engineer-III
Square,"Senior Software Engineer - Fraud Risk",https://www.smartrecruiters.com/Square/743999951095074
Square,"Full-Stack Software Engineer, ECOM Advanced Customization",https://www.smartrecruiters.com/Square/743999967440333
Square,"Lead Software Engineer, Backend",https://www.smartrecruiters.com/Square/743999970249103
Square,"Senior Software Engineer (Fullstack), Restaurants",https://www.smartrecruiters.com/Square/743999970219968
Square,"Senior Software Engineer (Mobile), Bitkey",https://www.smartrecruiters.com/Square/743999949900613
Square,"Senior Software Engineer - Support Product, Health",https://www.smartrecruiters.com/Square/743999960776523
Square,"Senior Software Engineer, Bitcoin Platform",https://www.smartrecruiters.com/Square/743999967900693
Square,"Senior Software Engineer, Core OS Platform",https://www.smartrecruiters.com/Square/743999967617954
Square,"Software Engineer (Android), Connected Device Experience",https://www.smartrecruiters.com/Square/743999959931427
Square,"Software Engineer, Backend (TIDAL)",https://www.smartrecruiters.com/Square/743999969382760
Square,"Software Engineering Manager, Subscriptions",https://www.smartrecruiters.com/Square/743999967149233
Square,"Software Engineering Manager, Subscriptions",https://www.smartrecruiters.com/Square/743999967149113
Square,"Staff Software Engineer (Cryptography), Bitkey",https://www.smartrecruiters.com/Square/743999967437363
Square,"Staff Software Engineer (Tech Lead)",https://www.smartrecruiters.com/Square/743999968931783
Square,"Staff Software Engineer - Identity and Access Management, Health",https://www.smartrecruiters.com/Square/743999963861573
Square,"Staff Software Engineer - Treasury, Financial Platform",https://www.smartrecruiters.com/Square/743999960770264
Square,"Staff Software Engineer, Square Bank Accounts",https://www.smartrecruiters.com/Square/743999968142061
Square,"Lead Software Engineering Program Manager, Square Hardware",https://www.smartrecruiters.com/Square/743999958848486
Square,"Lead Software Engineer, Backend",https://jobs.smartrecruiters.com/Square/743999970249103-lead-software-engineer-backend
Square,"Senior Software Engineer (Fullstack), Restaurants",https://jobs.smartrecruiters.com/Square/743999970219968-senior-software-engineer-fullstack-restaurants
Square,"Software Engineer, Backend (TIDAL)",https://jobs.smartrecruiters.com/Square/743999969382760-software-engineer-backend-tidal-
Square,"Staff Software Engineer (Tech Lead)",https://jobs.smartrecruiters.com/Square/743999968931783-staff-software-engineer-tech-lead-
Square,"Staff Software Engineer, Square Bank Accounts",https://jobs.smartrecruiters.com/Square/743999968142061-staff-software-engineer-square-bank-accounts
Square,"Senior Software Engineer, Bitcoin Platform",https://jobs.smartrecruiters.com/Square/743999967900693-senior-software-engineer-bitcoin-platform
Square,"Senior Software Engineer, Core OS Platform",https://jobs.smartrecruiters.com/Square/743999967617954-senior-software-engineer-core-os-platform
Square,"Full-Stack Software Engineer, ECOM Advanced Customization",https://jobs.smartrecruiters.com/Square/743999967440333-full-stack-software-engineer-ecom-advanced-customization
Square,"Staff Software Engineer (Cryptography), Bitkey",https://jobs.smartrecruiters.com/Square/743999967437363-staff-software-engineer-cryptography-bitkey
Square,"Software Engineering Manager, Subscriptions",https://jobs.smartrecruiters.com/Square/743999967149233-software-engineering-manager-subscriptions
Square,"Software Engineering Manager, Subscriptions",https://jobs.smartrecruiters.com/Square/743999967149113-software-engineering-manager-subscriptions
Square,"Staff Software Engineer - Identity and Access Management, Health",https://jobs.smartrecruiters.com/Square/743999963861573-staff-software-engineer-identity-and-access-management-health
Square,"Senior Software Engineer - Support Product, Health",https://jobs.smartrecruiters.com/Square/743999960776523-senior-software-engineer-support-product-health
Square,"Staff Software Engineer - Treasury, Financial Platform",https://jobs.smartrecruiters.com/Square/743999960770264-staff-software-engineer-treasury-financial-platform
Square,"Software Engineer (Android), Connected Device Experience",https://jobs.smartrecruiters.com/Square/743999959931427-software-engineer-android-connected-device-experience
Square,"Lead Software Engineering Program Manager, Square Hardware",https://jobs.smartrecruiters.com/Square/743999958848486-lead-software-engineering-program-manager-square-hardware
Square,"Senior Software Engineer - Fraud Risk",https://jobs.smartrecruiters.com/Square/743999951095074-senior-software-engineer-fraud-risk
Square,"Senior Software Engineer (Mobile), Bitkey",https://jobs.smartrecruiters.com/Square/743999949900613-senior-software-engineer-mobile-bitkey
Square,"Senior Software Engineer (Backend), Invoices",https://www.smartrecruiters.com/Square/743999970813629
Square,"Senior Software Engineer (iOS), Invoices",https://www.smartrecruiters.com/Square/743999970813564
Square,"Software Engineer, Payment Onboarding",https://www.smartrecruiters.com/Square/743999970919458
Square,"Software Engineer, Payment Onboarding",https://jobs.smartrecruiters.com/Square/743999970919458-software-engineer-payment-onboarding
Square,"Senior Software Engineer (Backend), Invoices",https://jobs.smartrecruiters.com/Square/743999970813629-senior-software-engineer-backend-invoices
Square,"Senior Software Engineer (iOS), Invoices",https://jobs.smartrecruiters.com/Square/743999970813564-senior-software-engineer-ios-invoices
Square,"Software Engineer (Backend), Cards API",https://www.smartrecruiters.com/Square/743999971178493
Square,"Software Engineer, Bank Accounts API",https://www.smartrecruiters.com/Square/743999971215693
Square,"Software Engineer, Bank Accounts API",https://jobs.smartrecruiters.com/Square/743999971215693-software-engineer-bank-accounts-api
Square,"Software Engineer (Backend), Cards API",https://jobs.smartrecruiters.com/Square/743999971178493-software-engineer-backend-cards-api
"WatchGuard Technologies","Senior Software Developer",https://jobs.lever.co/watchguard/04385197-40b6-4368-929a-e8a1436c7feb
Narvar,"Principal Software Engineer",https://boards.greenhouse.io/narvar/jobs/5672475
Narvar,"Senior Software Engineer I, Distributed Systems",https://boards.greenhouse.io/narvar/jobs/5684260
Narvar,"Senior Software Engineer II, Distributed Systems",https://boards.greenhouse.io/narvar/jobs/5590730
Narvar,"Senior Software Engineer II, Distributed Systems",https://boards.greenhouse.io/narvar/jobs/5543612
Narvar,"Sr. Software Engineer I, Fullstack",https://boards.greenhouse.io/narvar/jobs/5587180
Narvar,"Sr. Software Engineer II, Distributed Systems",https://boards.greenhouse.io/narvar/jobs/5587114
Narvar,"Sr. Software Engineer II, Ruby on Rails and React",https://boards.greenhouse.io/narvar/jobs/5645099
Narvar,"Staff Software Engineer, Distributed Systems",https://boards.greenhouse.io/narvar/jobs/5543584
Narvar,"Staff Software Engineer, Machine Learning",https://boards.greenhouse.io/narvar/jobs/5388095
Narvar,"Staff Software Engineer, Frontend",https://boards.greenhouse.io/narvar/jobs/5779622
SpotOn,"Staff Software Engineer",https://boards.greenhouse.io/spotonproduct/jobs/5856010003
SpotOn,"Senior Software Engineer (Python)",https://boards.greenhouse.io/spotonproduct/jobs/5892128003
SpotOn,"Senior Software Engineer (React/Python)",https://boards.greenhouse.io/spotonproduct/jobs/5905355003
Affirm,"Senior Software Engineer, Backend (Disclosures)",https://boards.greenhouse.io/affirm/jobs/5842402003
Affirm,"Senior Software Engineer (Consumer Pricing)",https://boards.greenhouse.io/affirm/jobs/5838911003
Affirm,"Senior Software Engineer (Partner Pricing)",https://boards.greenhouse.io/affirm/jobs/5855830003
Affirm,"Software Engineer, Early Career",https://boards.greenhouse.io/affirm/jobs/5794767003
Affirm,"Software Engineer II, Backend (Checkout)",https://boards.greenhouse.io/affirm/jobs/5828240003
Affirm,"Staff Software Engineer (Purchasing Experience)",https://boards.greenhouse.io/affirm/jobs/5879302003
Affirm,"Senior Software Engineer (Android Platform)",https://boards.greenhouse.io/affirm/jobs/5870224003
Affirm,"Senior Software Engineer (Comms Platform)",https://boards.greenhouse.io/affirm/jobs/5888448003
Affirm,"Senior Software Engineer (Comms Platform)",https://boards.greenhouse.io/affirm/jobs/5882466003
Affirm,"Senior Staff Software Engineer (Repayments)",https://boards.greenhouse.io/affirm/jobs/5870727003
Affirm,"Senior Staff Software Engineer (Repayments)",https://boards.greenhouse.io/affirm/jobs/5870729003
Affirm,"Software Engineer, Backend (Card & Pay Later)",https://boards.greenhouse.io/affirm/jobs/5852399003
Affirm,"Software Engineer, Backend (Card & Pay Later)",https://boards.greenhouse.io/affirm/jobs/5898331003
Affirm,"Software Engineer, Backend (Card & Pay Later)",https://boards.greenhouse.io/affirm/jobs/5898332003
Affirm,"Software Engineer, Early Career",https://boards.greenhouse.io/affirm/jobs/5794751003
Affirm,"Senior Software Engineer (Data & Reporting)",https://boards.greenhouse.io/affirm/jobs/5855410003
Affirm,"Software Engineer II",https://boards.greenhouse.io/affirm/jobs/5855406003
Affirm,"Software Engineer II, Backend (Consumer Payments)",https://boards.greenhouse.io/affirm/jobs/5869371003
Affirm,"Software Engineer II, Fullstack (Capital Orchestration)",https://boards.greenhouse.io/affirm/jobs/5848767003
Affirm,"Software Engineer (Loans Platform)",https://boards.greenhouse.io/affirm/jobs/5754341003
Affirm,"Director, Software Engineering (Testing Automation, Enablement and Tooling)",https://boards.greenhouse.io/affirm/jobs/5874258003
Affirm,"Senior Software Engineer (Compute)",https://boards.greenhouse.io/affirm/jobs/5850199003
Affirm,"Senior Software Engineer (Data and Storage Services)",https://boards.greenhouse.io/affirm/jobs/5829075003
Affirm,"Senior Software Engineer (Infrastructure platform)",https://boards.greenhouse.io/affirm/jobs/5855004003
Affirm,"Senior Software Engineer (Infrastructure Platform)",https://boards.greenhouse.io/affirm/jobs/5847096003
Affirm,"Senior Software Engineer (Online Storage)",https://boards.greenhouse.io/affirm/jobs/5854854003
Affirm,"Senior Software Engineer (Online Storage)",https://boards.greenhouse.io/affirm/jobs/5850217003
Affirm,"Senior Software Engineer (Streaming Infrastructure)",https://boards.greenhouse.io/affirm/jobs/5825409003
Affirm,"Staff Software Engineer (Online Services)",https://boards.greenhouse.io/affirm/jobs/5850203003
Affirm,"Software Engineer, Backend (Partner Interface)",https://boards.greenhouse.io/affirm/jobs/5765591003
Affirm,"Software Engineer, Backend (Partner Interface)",https://boards.greenhouse.io/affirm/jobs/5888153003
Affirm,"Senior Software Engineer, Backend (Fraud Decisioning)",https://boards.greenhouse.io/affirm/jobs/5807963003
Affirm,"Senior Software Engineer, Backend (Fraud Decisioning)",https://boards.greenhouse.io/affirm/jobs/5807965003
Affirm,"Senior Software Engineer, Backend (Identity Decisioning)",https://boards.greenhouse.io/affirm/jobs/5883412003
Affirm,"Senior Software Engineer, Backend (Identity Decisioning)",https://boards.greenhouse.io/affirm/jobs/5883414003
Affirm,"Senior Software Engineer, Backend, Trust & Safety",https://boards.greenhouse.io/affirm/jobs/5871667003
Affirm,"Senior Software Engineer, Backend (T&S Foundations)",https://boards.greenhouse.io/affirm/jobs/5880937003
Affirm,"Senior Software Engineer, Backend (T&S Foundations)",https://boards.greenhouse.io/affirm/jobs/5880938003
Affirm,"Software Engineer, Backend (Issuing)",https://boards.greenhouse.io/affirm/jobs/5878053003
Affirm,"Software Engineer I (Data storage and Services)",https://boards.greenhouse.io/affirm/jobs/5901789003
Affirm,"Software Engineer II (Storage Services)",https://boards.greenhouse.io/affirm/jobs/5901841003
Affirm,"Software Engineer II (Storage Services)",https://boards.greenhouse.io/affirm/jobs/5904324003
Affirm,"Software Engineer II, Fullstack (Merchant Insights)",https://boards.greenhouse.io/affirm/jobs/5889121003
Affirm,"Software Engineer II (Data and Storage Services)",https://boards.greenhouse.io/affirm/jobs/5829079003
Affirm,"Software Engineer II, Fullstack (Checkout Experience)",https://boards.greenhouse.io/affirm/jobs/5882470003
Affirm,"Software Engineer I (Repayment UX)",https://boards.greenhouse.io/affirm/jobs/5858684003
Affirm,"Software Engineer I (Repayment UX)",https://boards.greenhouse.io/affirm/jobs/5842395003
Affirm,"Senior Staff Software Engineer (Fraud Decisioning)",https://boards.greenhouse.io/affirm/jobs/5907102003
Affirm,"Senior Staff Software Engineer (Fraud Decisioning)",https://boards.greenhouse.io/affirm/jobs/5907104003
"Epos Now","Software Engineer - Data Platform",https://eposnowgroup.bamboohr.com/careers/225
"Epos Now","Software Product Developer",https://eposnowgroup.bamboohr.com/careers/78
"Iteris, Inc","Sr. Embedded Software Engineer",https://us232.dayforcehcm.com/CandidatePortal/en-US/iteris/Posting/View/1797
Productboard,"Senior Staff Software Engineer",https://boards.greenhouse.io/productboard/jobs/7058128002
Productboard,"Staff Software Engineer",https://boards.greenhouse.io/productboard/jobs/7058108002
Productboard,"Staff Software Engineer",https://boards.greenhouse.io/productboard/jobs/7215293002
CareRev,"Sr. Staff Software Engineer (Platform Team)",https://boards.greenhouse.io/carerev/jobs/5794925003
Abacus.AI,"SOFTWARE ENGINEER - BACKEND SYSTEMS",https://abacus.ai/mailto:jobs@abacus.ai
Abacus.AI,"SOFTWARE ENGINEER 1 - MACHINE LEARNING",https://abacus.ai/mailto:jobs@abacus.ai
Abacus.AI,"SENIOR SOFTWARE ENGINEER - MACHINE LEARNING",https://abacus.ai/mailto:jobs@abacus.ai
Outschool,"Staff Software Engineer",https://boards.greenhouse.io/outschool/jobs/4305435006
Retool,"Software Engineer, Build and Release",https://boards.greenhouse.io/retool/jobs/4044560005
Retool,"Software Engineer",https://boards.greenhouse.io/retool/jobs/4003629005
Retool,"Software Engineer, Performance",https://boards.greenhouse.io/retool/jobs/4337238005
Aurora,"Principal Software Engineer, ML Accelerators",https://boards.greenhouse.io/aurorainnovation/jobs/6905776002
Aurora,"Principal Software Engineer, ML Accelerators",https://boards.greenhouse.io/aurorainnovation/jobs/6905787002
Aurora,"Principal Software Engineer, ML Accelerators",https://boards.greenhouse.io/aurorainnovation/jobs/6906067002
Aurora,"Sr Staff Software Engineer, ML Accelerators",https://boards.greenhouse.io/aurorainnovation/jobs/5580045002
Aurora,"Sr Staff Software Engineer, ML Accelerators",https://boards.greenhouse.io/aurorainnovation/jobs/5580049002
Aurora,"Sr Staff Software Engineer, ML Accelerators",https://boards.greenhouse.io/aurorainnovation/jobs/5574800002
Aurora,"Embedded Software Intern",https://boards.greenhouse.io/aurorainnovation/jobs/7240893002
Aurora,"Staff Embedded Software Engineer, Cameras",https://boards.greenhouse.io/aurorainnovation/jobs/7037677002
Aurora,"Staff Embedded Software Engineer, Cameras",https://boards.greenhouse.io/aurorainnovation/jobs/6962112002
Aurora,"Senior Software Engineer, Motion Planning Data",https://boards.greenhouse.io/aurorainnovation/jobs/7116848002
Aurora,"Senior Software Engineer, Motion Planning Data",https://boards.greenhouse.io/aurorainnovation/jobs/7102022002
Aurora,"Senior Software Engineer, Motion Planning Data",https://boards.greenhouse.io/aurorainnovation/jobs/7116847002
Aurora,"Staff Software Engineer, Motion Planning Systems",https://boards.greenhouse.io/aurorainnovation/jobs/7108530002
Aurora,"Staff Software Engineer, Motion Planning Systems",https://boards.greenhouse.io/aurorainnovation/jobs/7251947002
Aurora,"Staff Software Engineer, Motion Planning Systems",https://boards.greenhouse.io/aurorainnovation/jobs/7251951002
Aurora,"Staff Software Engineer",https://boards.greenhouse.io/aurorainnovation/jobs/7213838002
Aurora,"Senior Staff Technical Program Manager - Platform Software and HW/SW Integration",https://boards.greenhouse.io/aurorainnovation/jobs/7032732002
Aurora,"Senior Staff Software Engineer - Deployment / Linux Platforms",https://boards.greenhouse.io/aurorainnovation/jobs/7256017002
StockX,"Senior Software Engineer - Platform Engineering",https://boards.greenhouse.io/stockx/jobs/7107386002
StockX,"Software Development Engineer in Test",https://boards.greenhouse.io/stockx/jobs/7158692002
StockX,"Software Engineer",https://boards.greenhouse.io/stockx/jobs/7171104002
StockX,"Software Engineer-iOS",https://boards.greenhouse.io/stockx/jobs/7094317002
StockX,"Software Engineer-Web",https://boards.greenhouse.io/stockx/jobs/7246424002
Vroom,"Software Engineer II - Full Stack .NET Developer",https://vroom.wd5.myworkdayjobs.com/en-US/uacc/job/Fort-Worth-TX/Software-Engineer-II---Full-Stack-NET-Developer_R240098
Zenoti,"Senior Software Engineer (.NET)",https://boards.greenhouse.io/zenoti/jobs/5896118003
Zenoti,"Senior Software Engineer (Tableau)",https://boards.greenhouse.io/zenoti/jobs/5859291003
Webflow,"Senior Software Engineer, Data Visualization Products",https://boards.greenhouse.io/webflow/jobs/5716980
Webflow,"Senior Software Engineer, Libraries",https://boards.greenhouse.io/webflow/jobs/5563413
Webflow,"Senior Software Engineer, Web Rendering",https://boards.greenhouse.io/webflow/jobs/5598316
Tekion,"Lead Software Engineer - Frontend",https://boards.greenhouse.io/tekion/jobs/5854603003
Tekion,"Staff Software Engineer",https://boards.greenhouse.io/tekion/jobs/5395415003
Bandwidth,"Software Developer III",https://boards.greenhouse.io/bandwidth/jobs/5766636
Vonage,"Java Software Engineer",https://boards.greenhouse.io/vonage/jobs/7018622002
Vonage,"Java Software Engineer",https://boards.greenhouse.io/vonage/jobs/7018627002
Vonage,"Java Software Engineer (BSS)",https://boards.greenhouse.io/vonage/jobs/7069350002
Vonage,"Java Software Engineer II",https://boards.greenhouse.io/vonage/jobs/7191170002
Vonage,".NET Software Engineer",https://boards.greenhouse.io/vonage/jobs/7049953002
Vonage,"Senior Java Software Engineer",https://boards.greenhouse.io/vonage/jobs/7018608002
Vonage,"Senior Java Software Engineer (BSS)",https://boards.greenhouse.io/vonage/jobs/7069506002
Vonage,"Senior Software Engineer",https://boards.greenhouse.io/vonage/jobs/7262394002
Vonage,"Senior Software Engineer - UI",https://boards.greenhouse.io/vonage/jobs/7262584002
Vonage,"Software Architect",https://boards.greenhouse.io/vonage/jobs/6911425002
Vonage,"Software Development Engineer in Test (QA)",https://boards.greenhouse.io/vonage/jobs/7074206002
Vonage,"Software Engineer (Data Services)",https://boards.greenhouse.io/vonage/jobs/7054899002
Vonage,"Software Engineer (Data Services)",https://boards.greenhouse.io/vonage/jobs/7054898002
Vonage,"Software Engineer - Full Stack (Go/JS)",https://boards.greenhouse.io/vonage/jobs/7055125002
Vonage,"Software Engineer - Full Stack (Go/JS)",https://boards.greenhouse.io/vonage/jobs/7262581002
Vonage,"Software Engineer (Java)",https://boards.greenhouse.io/vonage/jobs/7115360002
Vonage,"Software Engineer (OSS)",https://boards.greenhouse.io/vonage/jobs/7054851002
Vonage,"Software Engineer (OSS)",https://boards.greenhouse.io/vonage/jobs/7054852002
Vonage,"Software Engineer - UI",https://boards.greenhouse.io/vonage/jobs/7072991002
Vonage,"Software Team Lead",https://boards.greenhouse.io/vonage/jobs/7253006002
Vonage,"Sr Software Engineer (Data Services)",https://boards.greenhouse.io/vonage/jobs/7054916002
Vonage,"Sr Software Engineer (Data Services)",https://boards.greenhouse.io/vonage/jobs/7054917002
Vonage,"Sr Software Engineer (Verify)",https://boards.greenhouse.io/vonage/jobs/7054951002
Vonage,"VP of Software Engineering",https://boards.greenhouse.io/vonage/jobs/6967330002
Vonage,"VP of Software Engineering",https://boards.greenhouse.io/vonage/jobs/6968707002
AppDirect,"Software Sales Specialist",https://boards.greenhouse.io/appdirect/jobs/7178707002
AppDirect,"Senior Software Engineer",https://boards.greenhouse.io/appdirect/jobs/7122397002
Dialpad,"Senior Software Engineer, Fullstack, Supervisor Experience",https://boards.greenhouse.io/dialpad/jobs/7254433002
Dialpad,"Senior Software Engineer, Growth",https://boards.greenhouse.io/dialpad/jobs/7254467002
Dialpad,"Software Engineer",https://boards.greenhouse.io/dialpad/jobs/7247061002
Dialpad,"Software Engineer, Call Features",https://boards.greenhouse.io/dialpad/jobs/7252250002
Dialpad,"Staff Software Engineer, Backend, Product Infrastructure",https://boards.greenhouse.io/dialpad/jobs/7101396002
Dialpad,"Senior Software Engineer, Backend, Developer Platform",https://boards.greenhouse.io/dialpad/jobs/7061959002
Dialpad,"Senior Software Engineer, Fullstack, Integrations",https://boards.greenhouse.io/dialpad/jobs/7035228002
Dialpad,"Senior Software Developer in Test",https://boards.greenhouse.io/dialpad/jobs/7122564002
Dialpad,"Senior Software Developer in Test",https://www.dialpad.com/careers/jobs/apply/senior-software-developer-in-test/buenos-aires-argentina
Dialpad,"Senior Software Engineer, Android","https://www.dialpad.com/careers/jobs/apply/senior-software-engineer,-android/buenos-aires-argentina"
Dialpad,"Senior Software Engineer, Backend, Developer Platform","https://www.dialpad.com/careers/jobs/apply/senior-software-engineer,-backend,-developer-platform/buenos-aires-argentina"
Dialpad,"Senior Software Engineer, Fullstack, Integrations","https://www.dialpad.com/careers/jobs/apply/senior-software-engineer,-fullstack,-integrations/buenos-aires-argentina"
Dialpad,"Senior Software Engineer, Fullstack, Supervisor Experience","https://www.dialpad.com/careers/jobs/apply/senior-software-engineer,-fullstack,-supervisor-experience/buenos-aires-argentina"
Dialpad,"Senior Software Engineer, Growth","https://www.dialpad.com/careers/jobs/apply/senior-software-engineer,-growth/buenos-aires-argentina"
Dialpad,"Software Engineer",https://www.dialpad.com/careers/jobs/apply/software-engineer-/bengaluru-india
Dialpad,"Software Engineer, Call Features","https://www.dialpad.com/careers/jobs/apply/software-engineer,-call-features/buenos-aires-argentina"
Dialpad,"Staff Software Engineer, Backend, Product Infrastructure","https://www.dialpad.com/careers/jobs/apply/staff-software-engineer,-backend,-product-infrastructure/buenos-aires-argentina"
Dialpad,"Senior Software Engineer, Android",https://boards.greenhouse.io/dialpad/jobs/7261044002
Dialpad,"Software Engineer, Backend, Productivity","https://www.dialpad.com/careers/jobs/apply/software-engineer,-backend,-productivity/buenos-aires-argentina"
Dialpad,"Software Engineer, Backend, Productivity",https://boards.greenhouse.io/dialpad/jobs/7241083002
Broadvoice,"Software Engineering (NodeJS)",https://boards.greenhouse.io/broadvoice/jobs/4150234007
Regal.io,"Subject Matter Expert for B2C Sales Software, Director",https://jobs.lever.co/regalvoice/a8baf55a-93ce-4804-91ac-fcd51d173674
Regal.io,"Senior Software Engineer - Full Stack",https://jobs.lever.co/regalvoice/42b33162-e18e-4594-bab1-b71a6d335b4c
"Crexendo - HQ","Software Validation Engineer",https://workforcenow.adp.com/javascript:openJobDescription('9200601819363_1')
8x8,"Software Engineer in Test (SET)",https://8x8inc.wd5.myworkdayjobs.com/en-US/8x8_External_Careers/job/Singapore-8x8-Asia/Software-Engineer-in-Test_L9113-1
NUSO,"Senior Software Developer",https://nuso.applicantpro.com/jobs/2755886
AudioCodes,"BSP Software Engineer",https://www.audiocodes.com/careers/positions/7714A
OneBill,"Senior Software Engineer",https://www.onebillsoftware.com/job/senior-software-engineer/
"Observe AI","Principal Software Engineer",https://jobs.lever.co/observeai/fb54f44a-233d-4d2d-85b8-9d674def597f
"Observe AI","Software Development Engineer I (Backend)",https://jobs.lever.co/observeai/c24a74a8-fca4-4444-8dd6-dce005bdb80a
"Observe AI","Software Development Engineer II (Backend)",https://jobs.lever.co/observeai/57d6a14a-a0b0-4d68-b953-30f6b68d8d5b
"Observe AI","Software Development Engineer III (Backend)",https://jobs.lever.co/observeai/7474099a-1595-4ed5-9691-b3887d798f17
"Observe AI","Software Development Engineer in Test I",https://jobs.lever.co/observeai/318edefc-fd7e-4cde-a9f7-af04d004bd77
"Observe AI","Software Development Engineer IV (Backend)",https://jobs.lever.co/observeai/d9ddc661-a4c6-43c7-b10b-69c59e71e394
"Observe AI","Software Development Engineer in Test - II",https://jobs.lever.co/observeai/e723d424-ae35-4e6c-a681-50e489af5826
"Acronis, Inc.","Cloud Software Support Specialist",https://boards.greenhouse.io/acronis/jobs/7227028002
"Acronis, Inc.","Cloud Software Support Specialist",https://boards.greenhouse.io/acronis/jobs/7227034002
"Acronis, Inc.","Cloud Software Support Specialist",https://boards.greenhouse.io/acronis/jobs/7227035002
"Acronis, Inc.","Cloud Software Support Specialist",https://boards.greenhouse.io/acronis/jobs/7227036002
